{
"schema": "aurum.oci-conformance-profile",
"version": 1,
"profile": "oci-conformance-v1",
"lock": ".board/locks/oci/oci-conformance-v1.lock.json",
"lock_digest": "sha256:d8688881d55dd2c4ba33a0afa4fcafd796d639c9dab073344fcd724a44a5624b",
"network": "none",
"user": "65534:65534",
"cap_drop": "ALL",
"cap_add": "none",
"mounts": "none",
"devices": "none",
"sockets": "none",
"pull": "never",
"tmpfs": "rw,nosuid,nodev",
"checkout_readonly": true,
"read_only_rootfs": true,
"no_new_privileges": true,
"privileged": false,
"timeout_seconds": 60,
"memory_mb": 256,
"cpu_millis": 1000,
"pids_limit": 128,
"tmpfs_mb": 128,
"stdout_limit_bytes": 65536,
"stderr_limit_bytes": 65536,
"max_input_files": 10000,
"max_input_bytes": 67108864,
"module_cache": "/go/pkg/mod",
"module_cache_read_only": true,
"orchestrator": "trusted",
"orchestrator_root": "/tmp/aurum-oci-orchestrator",
"probe": "untrusted",
"probe_root": "/tmp/aurum-oci-probes",
"probe_image_set": "digest-pinned",
"probe_cgo": false,
"probe_output": "untrusted-observation",
"probe_verdict_authority": "denied",
"probe_writable_roots": ["/tmp/aurum-oci-probes"],
"verdict_authority": "orchestrator",
"report_mode": "ephemeral",
"report_root": "/tmp/aurum-oci-reports",
"supported_engines": ["docker", "podman"],
"unsupported_engine": "denied",
"engine_invocations": 0,
"engine_socket": "denied",
"engine_api": "denied",
"host_engine": "denied",
"egress": "denied",
"host_checkout": "denied",
"host_filesystem": "denied",
"subprocess": "denied",
"max_probes": 1024,
"max_probe_bytes": 65536,
"max_report_bytes": 1048576,
"probe_timeout_seconds": 5,
"environment": {"GOPROXY": "off", "GOSUMDB": "off", "GONOSUMDB": "*", "GOTOOLCHAIN": "local", "CGO_ENABLED": "0", "AURUM_OCI_ORCHESTRATOR_ROOT": "/tmp/aurum-oci-orchestrator", "AURUM_OCI_PROBE_ROOT": "/tmp/aurum-oci-probes", "AURUM_OCI_REPORT_ROOT": "/tmp/aurum-oci-reports", "DOCKER_HOST": "", "CONTAINER_HOST": "", "DOCKER_CONFIG": "/dev/null", "DOCKER_API_VERSION": "", "HTTP_PROXY": "", "HTTPS_PROXY": "", "NO_PROXY": "*"},
"command": ["go", "test", "-mod=readonly", "./..."]
}
